English	Dutch	PAGE	Commons	Sources	Remarks	Doculect	Forms	Glottocode	Glottolog_name	ID	tokenized	transliterated	ipa	Concepticon_ID	Concepticon_Gloss
inside	binnen	488		oudemans1879		Mentawai	kebâra	ment1249	Mentawai	417	k e b â r a	k e b a r a	k e b a r a	1606	INSIDE
inside	binnen	488		oudemans1879		Nias	bâcha	nias1242	Nias	418	b â c h a	b a k h a	b a k h a	1606	INSIDE
outside	buiten	488		oudemans1879		Enggano	ietofo	engg1245	Enggano	419	ie t o f o	i t O f O	i t ɔ f ɔ	762	OUTSIDE
outside	buiten	488		oudemans1879		Nias	bairô	nias1242	Nias	420	b ai r ô	b a:i r o	b ai r o	762	OUTSIDE
above	boven	488		oudemans1879		Enggano	ietebe	engg1245	Enggano	421	ie t e b e	i t e b e	i t e b e	1741	ABOVE
above	boven	488		oudemans1879		Mentawai	kepâta	ment1249	Mentawai	422	k e p â t a	k e p a t a	k e p a t a	1741	ABOVE
above	boven	488		oudemans1879		Nias	djâwa	nias1242	Nias	423	dj â w a	j a w a	d͡ʒ a w a	1741	ABOVE
beneath	beneden	488		oudemans1879		Enggano	ietofo	engg1245	Enggano	424	ie t o f o	i t O f O	i t ɔ f ɔ	1485	BELOW OR UNDER
beneath	beneden	488		oudemans1879		Mentawai	kepolak	ment1249	Mentawai	425	k e p o l a k	k e p O l a k	k e p ɔ l a k	1485	BELOW OR UNDER
beneath	beneden	488		oudemans1879		Nias	tauoe	nias1242	Nias	426	t a uoe	t a u ' u	t a u ʔ u	1485	BELOW OR UNDER
